id,title,summary,text,provement,label,time
1121,【#新疆新增本土病例4例#】新疆维吾尔自治区卫生健康委最新通报，8月15日0时至24时，新疆维吾尔自治区（含新疆生产建设兵团）报告新增新冠肺炎确诊病例4例，新增无症状感染者5例，均在乌鲁木齐市,7月15日0时至8月15日24时，累计治愈出院确诊病例425例，无症状感染者解除医学观察108例,【#新疆新增本土病例4例#】新疆维吾尔自治区卫生健康委最新通报，8月15日0时至24时，新疆维吾尔自治区（含新疆生产建设兵团）报告新增新冠肺炎确诊病例4例，新增无症状感染者5例，均在乌鲁木齐市；新增治愈出院确诊病例41例（其中乌鲁木齐市39例、喀什地区乌鲁木齐市疫情关联病例1例、兵团1例）；无症状感染者解除医学观察3例，均在乌鲁木齐市；危重症转普通型3例。截至8月15日24时，新疆（含兵团）现有确诊病例401例（危重症9例、重症25例），均为乌鲁木齐市病例；现有无症状感染者128例，其中乌鲁木齐市127例、昌吉州1例（乌鲁木齐市输入）；尚有10450人正在接受医学观察。7月15日0时至8月15日24时，累计治愈出院确诊病例425例，无症状感染者解除医学观察108例。,[],1,2020/8/16 8:16
1122,】在建筑工地，武汉“两神山”建设队伍复工，1500个工地同擂战鼓,【#当口罩遇上职业装#，晒出你的复工日常吧,【#当口罩遇上职业装#，晒出你的复工日常吧！】在建筑工地，武汉“两神山”建设队伍复工，1500个工地同擂战鼓；在田间地头，村民开始学着在手机前直播带货，开辟销路；在生产车间，工人们开足马力，赶制国内外订单…你的复工日常是啥样？带话题#让劳动者上头条#发条微博，晒晒你的口罩版最美工作照！ ​​​​,[],1,2020/4/29 19:28
1123,#38岁杭州民警牺牲在战疫一线#】3月9日下午，浙江省杭州市公安局上城区分局法制大队副大队长王益民，在抗疫期间突发身体不适送医救治，经全力抢救无效于10日凌晨殉职，年仅38岁,@中国警察网 ​​​​,#寻找抗疫平民英雄#【痛心！#38岁杭州民警牺牲在战疫一线#】3月9日下午，浙江省杭州市公安局上城区分局法制大队副大队长王益民，在抗疫期间突发身体不适送医救治，经全力抢救无效于10日凌晨殉职，年仅38岁。转发送别，英雄一路走好！@中国警察网 ​​​​,[],1,2020/3/10 15:40
1124,”无惧挑战，一往直前，时代不会辜负每一点努力，不会怠慢每一种执着，祝福考生，旗开得胜,经受战疫淬炼，心理将更强大,【#你好，明天#】明天，千万考生将踏进考场。经受战疫淬炼，心理将更强大。从容应对，奋笔疾书，用奋斗书写青春考卷，用汗水铺陈人生华章。“一定是特别光明的结果，才配得上这么出其不意的开局。”无惧挑战，一往直前，时代不会辜负每一点努力，不会怠慢每一种执着，祝福考生，旗开得胜！ ​​​​,[],1,2020/7/6 23:42
1125,2020年2月23日清晨6时30分，经救治无效在武汉大学中南医院去世,在抗击疫情一线不幸感染新冠肺炎，1月19日收治我院，医院全力救治,【送别！#武汉29岁医生因感染离世#】23日，武汉协和江北医院发布公告：协和江北医院/蔡甸区人民医院消化内科医生夏思思，女，29岁。在抗击疫情一线不幸感染新冠肺炎，1月19日收治我院，医院全力救治。2月7日病情恶化，医院紧急将其送往武汉大学中南医院救治。2020年2月23日清晨6时30分，经救治无效在武汉大学中南医院去世。O公 告,[],1,2020/2/23 14:59
1126,【#北京高校承担学生返校核酸检测费用#】北京市教委举行2020年北京市各级各类学校秋季开学工作新闻发布会，市委教育工委宣教处处长寇红江明确，费用由学校支付,,【#北京高校承担学生返校核酸检测费用#】北京市教委举行2020年北京市各级各类学校秋季开学工作新闻发布会，市委教育工委宣教处处长寇红江明确，费用由学校支付。 ​​​​,[],1,2020/8/14 17:22
1127,【#巴西教育部长感染新冠肺炎#，#巴西一天内两名部长宣称感染新冠#】人民日报记者张远南消息，据巴西卫生部，当地时间20日，巴西新增20257例新冠肺炎确诊病例，累计确诊2118646例，新增死亡632例，累计死亡80120例，共有超过140万名患者被治愈,当天早些时候，巴西公民和社会行动部长奥尼克斯·洛伦佐尼称自己感染了新冠肺炎,【#巴西教育部长感染新冠肺炎#，#巴西一天内两名部长宣称感染新冠#】人民日报记者张远南消息，据巴西卫生部，当地时间20日，巴西新增20257例新冠肺炎确诊病例，累计确诊2118646例，新增死亡632例，累计死亡80120例，共有超过140万名患者被治愈。另据央视，上周四（16日）刚刚宣誓就职的巴西新任教育部长米尔顿·里贝罗当地时间20日下午在社交媒体上宣布，他当天早些时候进行的新冠病毒检测结果呈阳性。里贝罗是一天之内，巴西第二位宣布自己感染新冠肺炎的部长。当天早些时候，巴西公民和社会行动部长奥尼克斯·洛伦佐尼称自己感染了新冠肺炎。,[],1,2020/7/21 8:22
1128,【#巴西新冠确诊超100万例#：日增超5万例】据巴西卫生部消息，当地时间19日，巴西新增54771例新冠肺炎确诊病例，累计确诊1032913例，新增死亡1206例，累计死亡48954例，共有超50万名患者被治愈,（人民日报记者张远南） ​​​​,【#巴西新冠确诊超100万例#：日增超5万例】据巴西卫生部消息，当地时间19日，巴西新增54771例新冠肺炎确诊病例，累计确诊1032913例，新增死亡1206例，累计死亡48954例，共有超50万名患者被治愈。其中，单日新增确诊病例数达新高。#巴西成继美国后第二个确诊超100万国家#。（人民日报记者张远南） ​​​​,[],1,2020/6/20 6:50
1129,（人民日报记者张意轩、胡润新） L人民日报的微博视频 ​​​​,从2月8日开始收治转院病人至今，历时67天，#雷神山患者清零#,【视频来了！#雷神山最后一批患者转院#】4月14日上午，雷神山最后一批患者转院。从2月8日开始收治转院病人至今，历时67天，#雷神山患者清零#。（人民日报记者张意轩、胡润新） L人民日报的微博视频 ​​​​,[],1,2020/4/14 9:49
1130,【#习近平寄语新时代青年#强调  坚定理想信念站稳人民立场  练就过硬本领投身强国伟业  向全国各族青年致以节日的祝贺和诚挚的问候】在五四青年节到来之际，中共中央总书记、国家主席、中央军委主席习近平代表党中央，向全国各族青年致以节日的祝贺和诚挚的问候,新时代中国青年要继承和发扬五四精神，坚定理想信念，站稳人民立场，练就过硬本领，投身强国伟业，始终保持艰苦奋斗的前进姿态，同亿万人民一道，在实现中华民族伟大复兴中国梦的新长征路上奋勇搏击,【#习近平寄语新时代青年#强调  坚定理想信念站稳人民立场  练就过硬本领投身强国伟业  向全国各族青年致以节日的祝贺和诚挚的问候】在五四青年节到来之际，中共中央总书记、国家主席、中央军委主席习近平代表党中央，向全国各族青年致以节日的祝贺和诚挚的问候！　　习近平指出，青春由磨砺而出彩，人生因奋斗而升华。面对突如其来的新冠肺炎疫情，全国各族青年积极响应党的号召，踊跃投身疫情防控人民战争、总体战、阻击战，不畏艰险、冲锋在前、真情奉献，展现了当代中国青年的担当精神，赢得了党和人民高度赞誉。我为你们感到骄傲！　　习近平强调，今年是决胜全面小康、决战脱贫攻坚的收官之年，也是实现“两个一百年”奋斗目标的历史交汇之年。新时代中国青年要继承和发扬五四精神，坚定理想信念，站稳人民立场，练就过硬本领，投身强国伟业，始终保持艰苦奋斗的前进姿态，同亿万人民一道，在实现中华民族伟大复兴中国梦的新长征路上奋勇搏击。　　习近平指出，各级党委和政府、各级领导干部以及全社会都要关心青年成长，支持广大青年建功立业。共青团要肩负起党赋予的光荣职责，团结带领广大团员青年为新时代党和国家事业发展作出新的更大的贡献。（新华社）,[],1,2020/5/3 15:04
1131,【#美国新冠肺炎超227万例#：#美国单日新增超2.7万例#】据美国约翰斯·霍普金斯大学疫情实时监测系统显示，截至美东时间6月21日下午5时33分，美国已有新冠病毒感染病例2274280例，其中包括死亡病例119935例,（人民日报记者郑琪）,【#美国新冠肺炎超227万例#：#美国单日新增超2.7万例#】据美国约翰斯·霍普金斯大学疫情实时监测系统显示，截至美东时间6月21日下午5时33分，美国已有新冠病毒感染病例2274280例，其中包括死亡病例119935例。与该系统约24小时前的数据相比，美国新增感染病例27060例，新增死亡病例384例。（人民日报记者郑琪）,[],1,2020/6/22 6:35
1132,【习近平：通过打这场硬仗，掌握更多核心科技，#拿出更多硬核产品#】习近平总书记2日在北京考察新冠肺炎防控科研攻关工作,他强调，人类同疾病较量最有力的武器就是科学技术，人类战胜大灾大疫离不开科学发展和技术创新,【习近平：通过打这场硬仗，掌握更多核心科技，#拿出更多硬核产品#】习近平总书记2日在北京考察新冠肺炎防控科研攻关工作。他强调，人类同疾病较量最有力的武器就是科学技术，人类战胜大灾大疫离不开科学发展和技术创新。协同推进新冠肺炎防控科研攻关，为打赢疫情防控阻击战提供科技支撑，一起努力！ ​​​​,[],1,2020/3/2 23:01
1133,教育部应对新冠肺炎疫情工作领导小组办公室主任、体育卫生与艺术教育司司长王登峰介绍，30个省份所有或部分地市已确定秋季开学时间，各地中小学、幼儿园在9月1日左右开学，与往年秋季开学时间大致相同,【教育部：#30省份已确定开学时间#】记者在27日上午举行的教育部新闻发布会上获悉，#教育部要求确保安全正常全面开学#,【教育部：#30省份已确定开学时间#】记者在27日上午举行的教育部新闻发布会上获悉，#教育部要求确保安全正常全面开学#。教育部应对新冠肺炎疫情工作领导小组办公室主任、体育卫生与艺术教育司司长王登峰介绍，30个省份所有或部分地市已确定秋季开学时间，各地中小学、幼儿园在9月1日左右开学，与往年秋季开学时间大致相同。高校根据新老生、不同年级、不同地域分批次在8月下旬至9月开学。75所教育部直属高校中，49所8月底前第一批学生返校，24所9月上旬第一批学生返校，2所9月中下旬第一批学生返校。（人民日报记者张烁）O网页链接,[],1,2020/8/27 10:36
1134,#国外援助中国抗疫物资清单#】截至3月2日，共有#71个国家9个国际组织向中国捐赠物资#,根据公开报道，整理清单如下↓↓这份情谊，我们铭记在心,【患难见真情！#国外援助中国抗疫物资清单#】截至3月2日，共有#71个国家9个国际组织向中国捐赠物资#。根据公开报道，整理清单如下↓↓这份情谊，我们铭记在心！ ​​​​,[],1,2020/3/7 11:12
1135,【最新：#全球新冠肺炎超379万例#】截至北京时间5月8日16时，214个国家和地区累计确诊3791050例，“钻石公主”号邮轮712例，全球新冠肺炎累计死亡269268例,转发关注#新冠肺炎疫情全球走势#↓↓ ​​​​,【最新：#全球新冠肺炎超379万例#】截至北京时间5月8日16时，214个国家和地区累计确诊3791050例，“钻石公主”号邮轮712例，全球新冠肺炎累计死亡269268例。其中，#美国新冠病毒感染病例超125万#。转发关注#新冠肺炎疫情全球走势#↓↓ ​​​​,[],1,2020/5/8 16:30
1136,【最新数据：#全球新冠肺炎超408万例#】截至北京时间5月11日17时，214个国家和地区累计确诊4080018例，“钻石公主”号邮轮712例，全球新冠肺炎累计死亡282657例,转发关注#新冠肺炎疫情全球走势#↓↓ ​​ ​​​​,【最新数据：#全球新冠肺炎超408万例#】截至北京时间5月11日17时，214个国家和地区累计确诊4080018例，“钻石公主”号邮轮712例，全球新冠肺炎累计死亡282657例。其中，#美国新冠肺炎病例超132万#。转发关注#新冠肺炎疫情全球走势#↓↓ ​​ ​​​​,[],1,2020/5/11 18:15
1137,#抗疫是香港当前头等大事#】近期，香港暴发新冠肺炎疫情，连续多日确诊病例过百，原本受到黑暴冲击的香港经济雪上加霜,生命至上防疫至重，同心抗疫刻不容缓,【生命至上！#抗疫是香港当前头等大事#】近期，香港暴发新冠肺炎疫情，连续多日确诊病例过百，原本受到黑暴冲击的香港经济雪上加霜。当前，抗疫成为香港的头等大事。中央政府明确表示，将为香港提供一切必要的支持和帮助。生命至上防疫至重，同心抗疫刻不容缓！ L人民日报的微博视频 ​​​​,[],1,2020/7/30 0:42
1138,【习近平：#武汉保卫战湖北保卫战取得决定性成果#】5月8日，中共中央在中南海召开党外人士座谈会，就新冠肺炎疫情防控工作听取各民主党派中央、全国工商联和无党派人士代表的意见和建议,习近平强调，经过艰苦卓绝的努力，武汉保卫战、湖北保卫战取得决定性成果，疫情防控阻击战取得重大战略成果，统筹推进疫情防控和经济社会发展工作取得积极成效,【习近平：#武汉保卫战湖北保卫战取得决定性成果#】5月8日，中共中央在中南海召开党外人士座谈会，就新冠肺炎疫情防控工作听取各民主党派中央、全国工商联和无党派人士代表的意见和建议。中共中央总书记习近平主持座谈会并发表重要讲话。习近平强调，经过艰苦卓绝的努力，武汉保卫战、湖北保卫战取得决定性成果，疫情防控阻击战取得重大战略成果，统筹推进疫情防控和经济社会发展工作取得积极成效。我们要继续抓紧做好各项工作，时刻绷紧疫情防控这根弦，扎实推进复工复产复学，确保完成决战决胜脱贫攻坚目标任务，全面建成小康社会。 °习近平：武汉保卫战、湖北保卫战取得决定性成果,[],1,2020/5/8 21:05
1139,嘉奖令号召，全军部队和广大官兵要向执行新冠肺炎疫情防控任务的全体人员学习，不忘初心、牢记使命，奋力推进强军事业,嘉奖令指出，突如其来的新冠肺炎疫情，对全军部队和广大官兵是一场大战和大考，执行疫情防控任务全体人员，以坚定信念、过硬能力、顽强作风、牺牲奉献，交出了一份圆满答卷,【中央军委主席习近平签署通令 嘉奖军队执行新冠肺炎疫情防控任务全体人员】中华人民共和国中央军事委员会主席习近平日前签署通令，嘉奖军队执行新冠肺炎疫情防控任务全体人员。嘉奖令指出，新冠肺炎疫情发生后，全军部队坚决贯彻党中央、中央军委决策号令，闻令而动、勇挑重担，不负重托、不辱使命，为打赢疫情防控人民战争、总体战、阻击战作出突出贡献。任务部队各级党组织和党员、干部勇当抗疫先锋队突击队，战斗在前、冲锋在前，充分发挥战斗堡垒和先锋模范作用，让党旗在防控疫情斗争第一线高高飘扬。广大医务人员义无反顾、坚韧不拔、日夜奋战、敢打硬仗，同时间赛跑、与病魔较量，发挥了抗疫斗争的中流砥柱作用。科研人员迎难而上、争分夺秒，全力以赴展开应急科研攻关，为疫情防控提供坚强有力科技支撑。新闻工作者不畏艰险、深入一线，大力宣传抗疫感人事迹，生动讲述军队抗疫故事，向中国和世界传播了强大正能量。担负组织协调、运输投送、安保警戒、勤务保障等任务人员日夜值守、不辞辛劳，同心协力、全力保障，铸就了疫情防控的坚强后盾。嘉奖令指出，突如其来的新冠肺炎疫情，对全军部队和广大官兵是一场大战和大考，执行疫情防控任务全体人员，以坚定信念、过硬能力、顽强作风、牺牲奉献，交出了一份圆满答卷。全体人员牢记我军宗旨，始终坚持人民利益高于一切，把人民群众生命安全和身体健康放在第一位，展现了人民子弟兵忠于党、忠于人民的政治品格；坚决贯彻坚定信心、同舟共济、科学防治、精准施策的总要求，加强组织领导、密切军地协同、坚持科学施治、搞好自身防护，锤炼了我军能打仗、打胜仗的过硬本领；始终视疫情为命令，召之即来、来之能战、战之能胜，危难时刻挺身而出，彰显了我军越是艰险越向前的大无畏革命精神，为党旗、军旗增添了光彩。嘉奖令号召，全军部队和广大官兵要向执行新冠肺炎疫情防控任务的全体人员学习，不忘初心、牢记使命，奋力推进强军事业。各级要坚持以习近平新时代中国特色社会主义思想为指导，深入贯彻习近平强军思想，深入贯彻新时代军事战略方针，增强“四个意识”、坚定“四个自信”、做到“两个维护”，贯彻军委主席负责制，坚持政治建军、改革强军、科技强军、人才强军、依法治军，聚力练兵备战，锐意开拓进取，为实现党在新时代的强军目标、把人民军队全面建成世界一流军队不懈奋斗！O中央军委主席习近平签署通令 嘉奖军队执行新...,[],1,2020/4/17 18:06
1140,这次集体默哀，源自政协委员冯丹龙2月19日的提案：“为体现对生命的尊重，对在抗击新冠肺炎病毒疫情中牺牲的医护工作者和去世的群众表示哀悼”，建议在开幕会上全体委员默哀,O网页链接 L人民日报的微博视频,【#全国政协开幕会默哀系委员提案#】21日下午，#全国政协十三届三次会议举行默哀仪式#。这次集体默哀，源自政协委员冯丹龙2月19日的提案：“为体现对生命的尊重，对在抗击新冠肺炎病毒疫情中牺牲的医护工作者和去世的群众表示哀悼”，建议在开幕会上全体委员默哀。第二天，全国政协提案委员会办公室即回复，“急事急办”，已转送政协办公厅。5月6日，冯丹龙接到电话，确认大会议程会有默哀仪式。O网页链接 L人民日报的微博视频,[],1,2020/5/21 15:53
1141,【#疑似病人拒绝隔离造成传播可定罪#：以危险方法危害公共安全罪】最高法、最高检等多部门联合印发《关于依法惩治妨害新型冠状病毒感染肺炎疫情防控违法犯罪的意见》，具有下列情形之一，危害公共安全的，依照刑法规定，以危险方法危害公共安全罪定罪处罚：①已经确诊病人、病原携带者，拒绝隔离治疗或者隔离期未满擅自脱离隔离治疗，并进入公共场所或者公共交通工具的,（人民日报记者倪弋）,【#疑似病人拒绝隔离造成传播可定罪#：以危险方法危害公共安全罪】最高法、最高检等多部门联合印发《关于依法惩治妨害新型冠状病毒感染肺炎疫情防控违法犯罪的意见》，具有下列情形之一，危害公共安全的，依照刑法规定，以危险方法危害公共安全罪定罪处罚：①已经确诊病人、病原携带者，拒绝隔离治疗或者隔离期未满擅自脱离隔离治疗，并进入公共场所或者公共交通工具的；②疑似病人拒绝隔离治疗或者隔离期未满擅自脱离隔离治疗，并进入公共场所或者公共交通工具，造成新型冠状病毒传播的。（人民日报记者倪弋）,[],1,2020/2/10 19:51
1142,设立隔离点后，她们主动申请到抗疫一线，负责接收隔离人员、安排入住，每天三次测体温、送餐，对每个楼层的垃圾进行打包、消杀、称重、运送.....每天工作十几个小时，轮班倒，很多时候要加班到凌晨三四点,L陕视新闻的微博视频,【辛苦了！#隔离点医护人员的日常#，有时凌晨四点还在倒垃圾】这两天，在西安市雁塔区新冠肺炎观察隔离点，来自长安大学校医院3名年轻的护士王艳妮、杨兰、李美娟一直在忙碌。设立隔离点后，她们主动申请到抗疫一线，负责接收隔离人员、安排入住，每天三次测体温、送餐，对每个楼层的垃圾进行打包、消杀、称重、运送.....每天工作十几个小时，轮班倒，很多时候要加班到凌晨三四点。L陕视新闻的微博视频,[],1,2020/3/26 20:29
1143,会上通报，疫情发生后，大连甘井子区在7月22日立即关停凯洋海鲜公司，转运企业人员进行集中隔离、核酸检测,L人民日报的微博视频,【#大连关停凯洋海鲜公司及周边企业#】今天上午，大连举行新冠肺炎疫情防控工作发布会。会上通报，疫情发生后，大连甘井子区在7月22日立即关停凯洋海鲜公司，转运企业人员进行集中隔离、核酸检测；7月23日，除保障群众生活和重要国计民生的企业正常运作外，对大连湾区域其他企业全部关停，对辖区全域实施封闭管理，居民居家观察，于25日全部完成核酸检测。L人民日报的微博视频,[],1,2020/8/2 10:21
1144,【#美国新冠肺炎超218万例#】据美国约翰斯·霍普金斯大学疫情实时监测系统显示，截至美东时间6月18日下午5时33分，美国已有新冠病毒感染病例2182285例，其中包括死亡病例118296例,与该系统约24小时前的数据相比，美国新增感染病例24517例，新增死亡病例674例,【#美国新冠肺炎超218万例#】据美国约翰斯·霍普金斯大学疫情实时监测系统显示，截至美东时间6月18日下午5时33分，美国已有新冠病毒感染病例2182285例，其中包括死亡病例118296例。与该系统约24小时前的数据相比，美国新增感染病例24517例，新增死亡病例674例。（郑琪） ​​​​,[],1,2020/6/19 6:40
1145,【#赵立坚回击美官员称中国传播5次瘟疫#：胡言乱语】据报道，美国总统国家安全事务助理奥布莱恩12日称，在过去的20年里，中国对外传播了5次瘟疫，包括非典、禽流感、猪流感和新冠肺炎,他们应该把精力放在做好自身防控工作、促进国际合作上，这才是他们应该做的,【#赵立坚回击美官员称中国传播5次瘟疫#：胡言乱语】据报道，美国总统国家安全事务助理奥布莱恩12日称，在过去的20年里，中国对外传播了5次瘟疫，包括非典、禽流感、猪流感和新冠肺炎。对此，14日举行的中国外交部例行记者会上，发言人赵立坚表示，美国政客为了抹黑别人，经常胡言乱语。奥布莱恩应该搞清楚事实再说话。据媒体报道，2009年猪流感公认始于美国，艾滋病也最先在美国暴发。我们始终认为，流行性疾病不分国界、种族，是人类的共同挑战。疫情可能在任何地方随时发生。疫情当前，美国政客不应一味“甩锅”、推责，这解决不了美国的问题。他们应该把精力放在做好自身防控工作、促进国际合作上，这才是他们应该做的。L海客新闻的秒拍视频,[],1,2020/5/14 22:17
1146,全省累计报告确诊病例149例，除治愈出院者外，现均在定点医院接受隔离治疗,确诊病例中，昆明市45例、西双版纳州15例、玉溪市14例、大理州13例、昭通市12例、曲靖市12例、保山市9例、丽江市7例、红河州6例、德宏州5例、楚雄州4例、普洱市4例、文山州2例、临沧市1例,【10日12时至24时，#云南新增确诊病例为零#】2月10日12时至24时，云南省报告新型冠状病毒肺炎新增确诊病例为零。全省累计报告确诊病例149例，除治愈出院者外，现均在定点医院接受隔离治疗。现有危重3例，重症15例，治愈出院19例，疑似病例109例，无死亡病例。密切接触者当日解除医学观察569人，正在观察3275人。确诊病例中，昆明市45例、西双版纳州15例、玉溪市14例、大理州13例、昭通市12例、曲靖市12例、保山市9例、丽江市7例、红河州6例、德宏州5例、楚雄州4例、普洱市4例、文山州2例、临沧市1例。（叶传增）,[],1,2020/2/11 11:31
