id,title,summary,text,provement,label,time
553,罗昌平：新冠疫情以来，几位院士丑态百出：有的谎话连篇，有的如门外汉，有的客串公关念错稿子，感觉院士名额就是各种既利集团分猪肉一样得来的,屠呦呦先生拿过诺贝尔医学奖，虽说科研经费分配可能吃亏，但晚节比头衔更重要，不要也罢,罗昌平：新冠疫情以来，几位院士丑态百出：有的谎话连篇，有的如门外汉，有的客串公关念错稿子，感觉院士名额就是各种既利集团分猪肉一样得来的。屠呦呦先生拿过诺贝尔医学奖，虽说科研经费分配可能吃亏，但晚节比头衔更重要，不要也罢！ ​​​​,经查，该微博配图称“2020年的两院院士评选，屠呦呦教授再次落选。”不实，@捉谣记 已辟谣：经核实，2020年并非增选院士的年份，两院院士去年刚刚增选过一轮，且屠呦呦并没有参选。详情：https://weibo.com/6590980486/IwtbnatRP，被举报人言论属于构成“发布不实信息”，现根据《微博举报投诉操作细则》（http://service.account.weibo.com/roles/guiding）第19条，对被举报人处理如下：扣除信用积分10分，禁言15天，禁被关注15天。上述处理在公布后60分钟内生效。,0,2020/2/29 20:10
554,而今，石正丽又说蚊子也是新冠病毒宿主，含有新冠病毒的蚊子也会直接传染人，从而漫延开去，引发疫情恐慌,石正丽跟美国一起研究蝙蝠新冠病毒这么多年，到底为了什么,大家看看，石正丽又出妖蛾子了！以前她一口咬定新冠病毒来自她的菊头蝠，挑起美国的“伯曼律师团队”状告中国，要向中国索要10亿美元经济损失赔偿，理由是中国隐瞒新冠病毒肺炎疫情，导致漫延美国！多么荒唐的诉状！而今，石正丽又说蚊子也是新冠病毒宿主，含有新冠病毒的蚊子也会直接传染人，从而漫延开去，引发疫情恐慌！石正丽，你的蝙蝠新冠病毒到底有多少宿主呀？！石正丽你到底要干嘛？！石正丽跟美国一起研究蝙蝠新冠病毒这么多年，到底为了什么？！为了瑞德西韦？还是让美国敲诈中国？！『石正丽凌晨发出警告：对疫情不必抱有太大乐观，蚊虫或成第三宿主』O石正丽凌晨发出警告：对疫情不必抱有太大乐观...,经查，该微博称“石正丽凌晨发出警告：对疫情不必抱有太大乐观，蚊虫或成第三宿主”不实，@环球网 已报道：武汉病毒所辟谣石正丽“蚊虫或成第三宿主”言论，石正丽研究员从未发布过任何相关信息，详情：https://weibo.com/1686546714/Iz33N9J1h，被举报人言论属于构成“发布不实信息”，现根据《微博举报投诉操作细则》（http://service.account.weibo.com/roles/guiding）第19条，对被举报人处理如下：扣除信用积分5分，禁言7天，禁被关注7天。上述处理在公布后60分钟内生效。,0,2020/3/17 15:44
555,为了获得美国绿卡，加入美国国籍，这名女子除了捐赠口罩之外，还从日本采购了3台医疗设备，献给了美国陆军野战医院，用于疑似感染的美军士兵治疗,"""我不是中国人""，华人女子获美国绿卡，慷慨对美捐赠20万只口罩 ""我已经获得美国绿卡，即将加入美国国籍，现在已经不是中国人""，短短的一句话在海外社交网站引起了巨大轰动","""我不是中国人""，华人女子获美国绿卡，慷慨对美捐赠20万只口罩 ""我已经获得美国绿卡，即将加入美国国籍，现在已经不是中国人""，短短的一句话在海外社交网站引起了巨大轰动。据海外媒体整理，这段话是一名来自中国宁波的女子。为了快速加入美国国籍，该女子以个人名义在中国采购了20万只口罩捐赠给美国国土安全部抵抗疫情。为了获得美国绿卡，加入美国国籍，这名女子除了捐赠口罩之外，还从日本采购了3台医疗设备，献给了美国陆军野战医院，用于疑似感染的美军士兵治疗。保守估计，该女子现如今已经给美国捐赠了超过300万美元的物资，而这一切，仅仅是为了加速获得美国国籍。【来源   兵戎要志】",经查，此微博称“女子慷慨对美捐赠20万只口罩，并称已经获得美国绿卡，即将加入美国国籍，现在已经不是中国人”等内容不实，据@宁波晚报：漏洞百出！系造谣。详情：https://weibo.com/1938523582/IwMiLFyoF，被举报人言论构成“发布不实信息”，且情节恶劣。现根据《微博举报投诉操作细则》（<http://service.account.weibo.com/roles/guiding>）第19条，对被举报人处理如下：永久禁言。上述处理在公布后60分钟内生效。,0,2020/3/2 14:17
556,希望就在眼前,市政府会议精神，3月16日居民出行正常化，17日公交正常化，18日逐步企业生产和市场经营正常化，22日重点场所正常化，25日机场、高速、动车、国道正常化,希望就在眼前…我期待着这一天早点到来。一刻都等不及了…西安学校开学时间：高三，初三，3月2日开学，高一，高二，初一，初二，3月9日开学，小学4一6年级，3月16日开学，幼儿园，小学1一3年级，大学，职校继续延时，直至疫情消除。市政府会议精神，3月16日居民出行正常化，17日公交正常化，18日逐步企业生产和市场经营正常化，22日重点场所正常化，25日机场、高速、动车、国道正常化。,经查，该微博称“3月16日居民出行正常化”不实，@中国互联网联合辟谣平台 已辟谣：类似信息已在武汉、无锡、温州、镇江、保定等多个地方传播，且该类信息已通过官方渠道多次辟谣，详情：https://weibo.com/6525943125/IvdThB8Vb，被举报人言论属于构成“发布不实信息”，现根据《微博举报投诉操作细则》（http://service.account.weibo.com/roles/guiding）第19条，对被举报人处理如下：扣除信用积分5分，禁言7天，禁被关注7天。上述处理在公布后60分钟内生效。,0,2020/2/18 21:33
557,东南亚检测能力很落后，大部分都根本不检测，死了都不知道，爆发风险非常大，一旦失控，大量难民会通过陆路拥入中国境内，广西云南贵州首当其冲,广西昨天一天从陆地口岸入境10万+，说是好多华人改道从越南和缅甸入境,留学生等已经是取道东南亚了，输入性传播有失控风险！广西昨天一天从陆地口岸入境10万+，说是好多华人改道从越南和缅甸入境。东南亚检测能力很落后，大部分都根本不检测，死了都不知道，爆发风险非常大，一旦失控，大量难民会通过陆路拥入中国境内，广西云南贵州首当其冲。形势非常严峻。 ​​​​,经查，此微博称“广西昨天一天从陆地口岸入境10万+，说是好多华人改道从越南和缅甸入境”不实。据@环球时报 报道，网传消息是谣言，无论陆路、水路还是航空，边境管控措施都是一样严格。详情：https://weibo.com/6525943125/IB0r7iyT8， 被举报人言论构成“发布不实信息”。现根据《微博举报投诉操作细则》（<http://service.account.weibo.com/roles/guiding>）第19条，对被举报人处理如下：扣除信用积分2分。上述处理在公布后60分钟内生效。,0,2020/3/28 15:42
558,加拿加总理特鲁多的夫人发了一段自拍视频，她算重症了，挺严重的，不能离开吸氧支撑，她一边咳嗽一边说：你们不要抱着侥幸心理了，新冠肺炎比想象的可怕,​​​​#全球疫情#  L爱国文青的微博视频 ​​​​,加拿加总理特鲁多的夫人发了一段自拍视频，她算重症了，挺严重的，不能离开吸氧支撑，她一边咳嗽一边说：你们不要抱着侥幸心理了，新冠肺炎比想象的可怕！   ​​​​#全球疫情#  L爱国文青的微博视频 ​​​​,经查，该微博发视频称“加拿加总理特鲁多的夫人发了一段自拍视频”不实，@海客新闻 报道：3月16日，英国伦敦一名39岁女子感染新冠肺炎后在重症监护室拍下视频发给同事，警告人们重视疫情，别再心存侥幸，以健康犯险，详情：https://weibo.com/7360594450/Izskv5HQG，被举报人言论属于构成“发布不实信息”，现根据《微博举报投诉操作细则》（http://service.account.weibo.com/roles/guiding）第19条，对被举报人处理如下：扣除信用积分2分。上述处理在公布后60分钟内生效。,0,2020/3/31 13:18
559,先到医疗研究中心做全部检查，阴性的回家隔离，阳性住院治疗,日本从武汉撤回来206位侨民、每人配一辆救护车,日本从武汉撤回来206位侨民、每人配一辆救护车 。不愧是世界卫生组织连续20年评定医疗水平世界第一的国家。先到医疗研究中心做全部检查，阴性的回家隔离，阳性住院治疗。中国，加油！ ​​​​,经查，此微博称“从武汉撤回来的日本人，迎接他们的是每个人一台救护车，206人=206台救护车”不实，@捉谣记 查证：日本政府实际配备救护车为20辆，网传消息不实。详情：https://weibo.com/6590980486/IrLFPf8TP。被投诉人言论构成“发布不实信息”，且情节恶劣。现根据《微博投诉操作细则》（http://service.account.weibo.com/roles/xize）第19条，对被投诉人处理如下：扣除信用积分20分，禁被关注30天，禁言30天。上述处理在公布后60分钟内生效。,0,2020/1/31 0:59
560,#产经智库# 呼吁：希望大家转发看到此人迅速报警别让病毒再次扩散🙏🙏🙏,#西安爆料##逃离武汉大作战# 老户县，新鄠(hu)邑(yi)，蒋村小伙吴建章，此人在武汉感染后逃离回家，被发现后在户县北关医院隔离治疗晚上8点左右又一次逃离,#西安爆料##逃离武汉大作战# 老户县，新鄠(hu)邑(yi)，蒋村小伙吴建章，此人在武汉感染后逃离回家，被发现后在户县北关医院隔离治疗晚上8点左右又一次逃离。👮大家，年都过不好了！一只老鼠坏了一锅汤。一声叹息，一地鸡毛！#产经智库# 呼吁：希望大家转发看到此人迅速报警别让病毒再次扩散🙏🙏🙏,经查，此微博称“鄠邑蒋村小伙吴建章，此人在武汉感染后逃离回家”不实，@鄠邑宣传 已辟谣：网上传言武汉归鄠人员吴某逃离医院纯属谣言。详情：https://weibo.com/3953623394/Ir6B8fdQK。被投诉人言论构成“发布不实信息”。现根据《微博投诉操作细则》（http://service.account.weibo.com/roles/xize）第19条，对被投诉人处理如下：扣除信用积分2分。上述处理在公布后60分钟内生效。,0,2020/1/25 9:12
561,肺炎超话#北京疫情##中国封国##新冠肺炎# @LX龙翔116 封国了🙃6月15日后外国人就不能来中国了 #疫情新发地##第二波疫情#         昨日，外交部、国家移民管理局发布公告：自6月15日0时起 暂停持有效中国签证、居留许可的外国人入境,也就是说中国正式封国了 关上大门 把病毒锁在国门之外 举全国之力的将现有的疫情和隐秘的病毒进行绞杀 同时更加有利于举国上下有序复工、复学,肺炎超话#北京疫情##中国封国##新冠肺炎# @LX龙翔116 封国了🙃6月15日后外国人就不能来中国了 #疫情新发地##第二波疫情#         昨日，外交部、国家移民管理局发布公告：自6月15日0时起 暂停持有效中国签证、居留许可的外国人入境。        也就是说中国正式封国了 关上大门 把病毒锁在国门之外 举全国之力的将现有的疫情和隐秘的病毒进行绞杀 同时更加有利于举国上下有序复工、复学。 ​ 2北京·中华人民共和国外交部,经查，该微博配图称“外交部，国家移民管理局发布公告：自2020年6月15日0时起，暂时停止持有效中国签证、居留许可的外国人入境”不实，经核实，该配图为后期合成，外交部于2020年3月26日已发布该公告。详情：https://weibo.com/1444313404/J6Is7fEYR。被投诉人言论构成“发布不实信息”。现根据《微博投诉操作细则》（http://service.account.weibo.com/roles/xize）第19条，对被投诉人处理如下：扣除信用积分2分。上述处理在公布后60分钟内生效。,0,2020/6/15 8:14
562,84岁的高龄钟南山 院士，再次出征北京，心系人民，迎难而上，报效国家，他就是最最耀眼的一颗星，为钟老点赞👍 #抗疫行动##致敬英雄 # L捍卫者的微博视频 ​​​​,,84岁的高龄钟南山 院士，再次出征北京，心系人民，迎难而上，报效国家，他就是最最耀眼的一颗星，为钟老点赞👍 #抗疫行动##致敬英雄 # L捍卫者的微博视频 ​​​​,经查，该微博配发视频称“钟南山院士已空降北京”不实，该内容已被@北京日报 辟谣 。详情：https://weibo.com/1893892941/J7dTA8Eh3 。被投诉人言论构成“发布不实信息”。现根据《微博投诉操作细则》（http://service.account.weibo.com/roles/xize）第24条，对被投诉人处理如下：扣除信用积分2分。上述处理在公布后60分钟内生效。,0,2020/6/18 13:57
563,【疫情当前，大意不得：全国已有12起复工后聚集性疫情发生】近期全国陆续复工，据不完全统计，复工后发生的聚集性疫情12起共15人确诊，18人传染，514人以上被隔离,包含内蒙古赤峰一发电厂、山西一发电厂、北京当当网 2重庆 ​​​​,【疫情当前，大意不得：全国已有12起复工后聚集性疫情发生】近期全国陆续复工，据不完全统计，复工后发生的聚集性疫情12起共15人确诊，18人传染，514人以上被隔离 。包含内蒙古赤峰一发电厂、山西一发电厂、北京当当网 2重庆 ​​​​,经查，该微博称“内蒙古赤峰一发电厂复工后发生的聚集性疫情”不实，@赤峰市公安局官方微博 已辟谣：经核实，该公司属于电力企业，一直处于生产状态，不存在复产复工问题。患者可能系与其儿子接触感染，目前该企业也无其他人员感染，详情：https://weibo.com/2406886261/Iwa0cFr3D，被举报人言论属于构成“发布不实信息”，现根据《微博举报投诉操作细则》（http://service.account.weibo.com/roles/guiding）第19条，对被举报人处理如下：扣除信用积分5分，禁言7天，禁被关注7天。上述处理在公布后60分钟内生效。,0,2020/2/22 23:00
564,#最硬管控# 网友爆料，湖北武穴市凡不属于疫情防控人员上街被抓的，一律送到市体育馆会展中心学习,还要完成初三《黄冈密卷》一张，成绩及格者可以回家,#最硬管控# 网友爆料，湖北武穴市凡不属于疫情防控人员上街被抓的，一律送到市体育馆会展中心学习。还要完成初三《黄冈密卷》一张，成绩及格者可以回家。怕是有人14天也回不了家了…#感受到了来自学校的关爱# ​​​​,经查，该微博称“乱上街的被抓去体育馆考黄冈密卷”不实，@黄冈政府门户网 已辟谣：武穴市武穴市疫情防控指挥部工作人员回应称，学习内容主要是这次新冠肺炎的防疫知识，比如公共场所应该怎么防护，我们会准备好操作文本，学习时间也不会很久，详情：https://weibo.com/5308838679/IuD9zl5OW，被举报人言论属于构成“发布不实信息”，现根据《微博举报投诉操作细则》（http://service.account.weibo.com/roles/guiding）第19条，对被举报人处理如下：扣除信用积分2分。上述处理在公布后60分钟内生效。,0,2020/2/17 16:03
565,美国的10艘医疗军舰已经开进纽约港，每艘船上有1000张病床，上面拥有所有的医疗抢救设施，每艘船相当于一个雷神山医院,—— 没想到第三次世界大战就这样开始了，是人类对病毒的战争,美国的10艘医疗军舰已经开进纽约港，每艘船上有1000张病床，上面拥有所有的医疗抢救设施，每艘船相当于一个雷神山医院。—— 没想到第三次世界大战就这样开始了，是人类对病毒的战争。 L恩威特监控专家的微博视频 ​​​​,经查，该微博称“美国的10艘医疗军舰已经开进纽约港”不实，@捉谣记 已辟谣：美国总统特朗普3月18日宣布将分别派遣医疗船前往纽约港和西岸地区，以缓解当地医疗力量不足。目前美国海军拥有两艘医疗船，每艘医疗船能放置1000张病床，详情：https://weibo.com/6590980486/Izvx0lmFG，被举报人言论属于构成“发布不实信息”，现根据《微博举报投诉操作细则》（http://service.account.weibo.com/roles/guiding）第19条，对被举报人处理如下：扣除信用积分5分，禁言7天，禁被关注7天。上述处理在公布后60分钟内生效。,0,2020/3/21 10:14
566,白宫官网消息：吉利德公司的瑞德西韦明日（2月3日）开始在中国临床试验,至2020年4月27日，允许中国仿制此药用于治疗冠状病毒患者,白宫官网消息：吉利德公司的瑞德西韦明日（2月3日）开始在中国临床试验。经特朗普总统特批，同意将该药物专利豁免，向中国紧急公开药物分子结构。至2020年4月27日，允许中国仿制此药用于治疗冠状病毒患者。 ​​​ ​​​​,经查，此微博称“经特朗普总统特批，同意将该药物专利豁免”不实，据@环球时报 记者发现这事并不存在。详情：https://weibo.com/1974576991/IsuVnAjmV，被举报人言论构成“发布不实信息”。现根据《微博举报投诉操作细则》（<http://service.account.weibo.com/roles/guiding>）第19条，对被举报人处理如下：扣除信用积分2分。上述处理在公布后60分钟内生效。,0,2020/2/2 22:20
567,#世卫组织警告全球性流行病威胁已成现实#吴好运，男，1958年6月生于四川省北川县，出生的第二年中国发生了三年自然灾害，饿了三年肚子的他慢慢长大了，然而他的父母却死于饥饿，1976年，17岁的他考入了华北煤炭医学院（唐山），1976年7月27日他从四川到学校报到，第二天，发生了唐山大地震，他在倒塌的房子下幸运地活了下来，2003年调入广州市第一人民医院，刚刚上班，非典爆发，2008年5月10日，他回家乡北川祭祖，还没来得及走，遇上了汶川大地震，2020年1月，调入武汉市中心医院，遇上了新冠肺炎，身为医生的他上了前线，1月27日被感染住院，2月23日病愈出院，前往福建泉州妻子处养病，入住欣佳宾馆隔离14天，3月7日晚，欣佳宾馆塌了，他没有躲过这次的追杀，享年62岁,你看这爹妈起的名字[发呆]倒霉催的[尴尬],#世卫组织警告全球性流行病威胁已成现实#吴好运，男，1958年6月生于四川省北川县，出生的第二年中国发生了三年自然灾害，饿了三年肚子的他慢慢长大了，然而他的父母却死于饥饿，1976年，17岁的他考入了华北煤炭医学院（唐山），1976年7月27日他从四川到学校报到，第二天，发生了唐山大地震，他在倒塌的房子下幸运地活了下来，2003年调入广州市第一人民医院，刚刚上班，非典爆发，2008年5月10日，他回家乡北川祭祖，还没来得及走，遇上了汶川大地震，2020年1月，调入武汉市中心医院，遇上了新冠肺炎，身为医生的他上了前线，1月27日被感染住院，2月23日病愈出院，前往福建泉州妻子处养病，入住欣佳宾馆隔离14天，3月7日晚，欣佳宾馆塌了，他没有躲过这次的追杀，享年62岁！你看这爹妈起的名字[发呆]倒霉催的[尴尬],经查，此微博称“吴好运入住泉州欣佳宾馆，没躲过追杀”？等内容不实，据@泉州网警巡查执法：该内容系谣言。详情：https://weibo.com/3094452711/IxQgMCkCj，被举报人言论构成“发布不实信息”，且情节恶劣。现根据《微博举报投诉操作细则》（<http://service.account.weibo.com/roles/guiding>）第19条，对被举报人处理如下：扣除信用积分5分，禁言7天，禁被关注7天。上述处理在公布后60分钟内生效。,0,2020/3/10 12:30
568,张文宏医生自爆收入和全家福，1969年出生，浙江瑞安人，从小喜欢读书，学习成绩优秀，在老家被邻里称为神童,3.每年在全球顶尖医学杂志（柳叶刀）上发表一篇署名论文，专利费2万美元,张文宏医生自爆收入和全家福，1969年出生，浙江瑞安人，从小喜欢读书，学习成绩优秀，在老家被邻里称为神童。张医生高考考入上海医学院，八年硕博连读后留学。现是全球知名的传染病专家。自爆年收入184万，来源于3个方面:1.华山医院呼吸科主任，工资奖金年入50万。2.国家重点项目学科带头人，年入120万。3.每年在全球顶尖医学杂志（柳叶刀）上发表一篇署名论文，专利费2万美元。,经查，该微博称“张文宏公示财产”不实，据张文宏本人回应，近期有关其个人家庭财产、生活隐私等讨论愈演愈烈，且纯属谣言，详情：https://new.qq.com/omn/20200406/20200406A0MTB400.html，被举报人言论属于构成“发布不实信息”，现根据《微博举报投诉操作细则》（http://service.account.weibo.com/roles/guiding）第19条，对被举报人处理如下：扣除信用积分2分。上述处理在公布后60分钟内生效。,0,2020/4/6 12:39
569,翻譯：俄羅斯放出來500隻獅子🦁️到街上（巡邏）確保人們都老老實實在家隔離#硬核##俄罗斯将限制与所有国家空中交通##俄罗斯派运输机支援意大利##俄罗斯疫情##全球疫情# ​​​​,,翻譯：俄羅斯放出來500隻獅子🦁️到街上（巡邏）確保人們都老老實實在家隔離#硬核##俄罗斯将限制与所有国家空中交通##俄罗斯派运输机支援意大利##俄罗斯疫情##全球疫情# ​​​​,经查，此微博配图称“俄罗斯在全国投放800只狮子老虎确保人们疫情期间待在家”不实。据@捉谣记 查证：俄罗斯并未做出投放800只老虎狮子的举措，消息所配图片是2016年南非约翰内斯堡的一家电影公司拍电影时的画面。详情：https://weibo.com/6590980486/IzVnCej47 被举报人言论构成“发布不实信息”。现根据《微博举报投诉操作细则》（<http://service.account.weibo.com/roles/guiding>）第19条，对被举报人处理如下：扣除信用积分2分。上述处理在公布后60分钟内生效。,0,2020/3/23 8:19
570,武汉三民小区的人全变红码，全市所有人全部核酸检测,三民小区封掉，5000人都变红码动不了，又隔离14天，上班的也不行了,武汉三民小区的人全变红码，全市所有人全部核酸检测！武汉三民小区出了六个感染者，清零很久以后出的，震动全国。是一个89岁的，之前感染自己好了，没去治疗，隔了两个月又发病传染人。武汉发了狠，所有人（除六岁以下）全部强制检测！三民小区封掉，5000人都变红码动不了，又隔离14天，上班的也不行了。全市10天都测一遍，不测的人变黄码无法出行，过期检测自己出钱。要测一个小区，就提前封闭。这是搞毛了，被病毒害的太惨。大样本检测，科研意义也很大。,经查，该微博称 “武汉东西湖区三民小区全部转红码”不实，@东西湖发布 已辟谣，详情https://weibo.com/2797392924/J1H0PzPZI，被投诉人言论构成“发布不实信息”。现根据《微博举报投诉操作细则》（http://service.account.weibo.com/roles/guiding）第19条，对被举报人处理如下：扣除信用积分2分。上述处理在公布后60分钟内生效。,0,2020/5/13 10:44
